{
  "client": "_reference",
  "version": "0.1.0",
  "environment": "production",
  "endpoints": {
    "api": {
      "baseUrl": "https://httpbin.org",
      "timeout": 8000,
      "auth": {
        "type": "bearer",
        "loginUrl": "/post",
        "tokenPath": "json.access_token"
      }
    }
  },
  "tags": {
    "client": "_reference",
    "environment": "production"
  }
}
